[
  {
    "term": "Post-Quantum Cryptography",
    "acronym": "PQC",
    "definition": "Cryptographic algorithms designed to be secure against attacks by both classical and quantum computers.",
    "technicalNote": "PQC algorithms are based on mathematical problems believed to be hard for quantum computers, such as lattice problems, hash functions, and error-correcting codes.",
    "relatedModule": "/learn/pqc-101",
    "complexity": "beginner",
    "category": "concept"
  },
  {
    "term": "Quantum Computing",
    "definition": "A type of computing that uses quantum-mechanical phenomena like superposition and entanglement to perform calculations exponentially faster than classical computers for certain problems.",
    "relatedModule": "/learn/pqc-101",
    "complexity": "beginner",
    "category": "concept"
  },
  {
    "term": "Q-Day",
    "definition": "The hypothetical future date when a quantum computer becomes powerful enough to break current public-key cryptography (RSA, ECC).",
    "relatedModule": "/threats",
    "complexity": "beginner",
    "category": "concept"
  },
  {
    "term": "Harvest Now, Decrypt Later",
    "acronym": "HNDL",
    "definition": "An attack strategy where adversaries collect encrypted data today with the intention of decrypting it once quantum computers become available.",
    "relatedModule": "/threats",
    "complexity": "beginner",
    "category": "concept"
  },
  {
    "term": "Encryption",
    "definition": "The process of converting readable data (plaintext) into an unreadable format (ciphertext) using an algorithm and a key, so only authorized parties can read it.",
    "relatedModule": "/learn/pqc-101",
    "complexity": "beginner",
    "category": "concept"
  },
  {
    "term": "Digital Signature",
    "definition": "A mathematical scheme that proves the authenticity and integrity of a digital message or document, analogous to a handwritten signature.",
    "relatedModule": "/learn/pki-workshop",
    "complexity": "beginner",
    "category": "concept"
  },
  {
    "term": "Public Key",
    "definition": "A cryptographic key that can be shared openly. Used to encrypt data or verify digital signatures.",
    "relatedModule": "/learn/pki-workshop",
    "complexity": "beginner",
    "category": "concept"
  },
  {
    "term": "Private Key",
    "definition": "A cryptographic key kept secret by its owner. Used to decrypt data or create digital signatures.",
    "relatedModule": "/learn/pki-workshop",
    "complexity": "beginner",
    "category": "concept"
  },
  {
    "term": "Key Pair",
    "definition": "A mathematically linked public key and private key used together for encryption/decryption or signing/verification.",
    "relatedModule": "/learn/pki-workshop",
    "complexity": "beginner",
    "category": "concept"
  },
  {
    "term": "Hybrid Cryptography",
    "definition": "Using both classical and post-quantum algorithms together during the transition period, providing security even if one algorithm is broken.",
    "relatedModule": "/learn/hybrid-crypto",
    "complexity": "beginner",
    "category": "concept"
  },
  {
    "term": "Crypto Agility",
    "definition": "The ability of a system to quickly switch between cryptographic algorithms without major redesign, critical for adapting to PQC.",
    "relatedModule": "/learn/crypto-agility",
    "complexity": "intermediate",
    "category": "concept"
  },
  {
    "term": "Qubit",
    "definition": "The basic unit of quantum information, analogous to a classical bit but capable of existing in superposition of 0 and 1 simultaneously.",
    "relatedModule": "/learn/pqc-101",
    "complexity": "beginner",
    "category": "concept"
  },
  {
    "term": "Superposition",
    "definition": "A quantum property where a qubit can represent both 0 and 1 at the same time, enabling quantum computers to explore many solutions simultaneously.",
    "relatedModule": "/learn/pqc-101",
    "complexity": "beginner",
    "category": "concept"
  },
  {
    "term": "Lattice-Based Cryptography",
    "definition": "A family of PQC algorithms based on the hardness of problems involving mathematical lattices. The basis for ML-KEM and ML-DSA.",
    "technicalNote": "Key problems: Learning With Errors (LWE), Module-LWE, Ring-LWE. Offer good performance and key sizes.",
    "relatedModule": "/algorithms",
    "complexity": "intermediate",
    "category": "concept"
  },
  {
    "term": "Hash-Based Signatures",
    "definition": "Digital signature schemes whose security relies only on the properties of hash functions. Very conservative security but can be stateful.",
    "technicalNote": "Stateful: LMS/XMSS (must track which keys are used). Stateless: SLH-DSA/SPHINCS+ (larger signatures).",
    "relatedModule": "/learn/stateful-signatures",
    "complexity": "intermediate",
    "category": "concept"
  },
  {
    "term": "Code-Based Cryptography",
    "definition": "PQC algorithms based on the hardness of decoding random linear error-correcting codes. Used by Classic McEliece and HQC.",
    "relatedModule": "/algorithms",
    "complexity": "advanced",
    "category": "concept"
  },
  {
    "term": "Security Level",
    "definition": "NIST defines 5 security levels for PQC algorithms. Level 1 ≈ AES-128, Level 3 ≈ AES-192, Level 5 ≈ AES-256.",
    "technicalNote": "Level 1: comparable to breaking AES-128. Level 5: comparable to breaking AES-256. Most deployments use Level 3.",
    "relatedModule": "/algorithms",
    "complexity": "intermediate",
    "category": "concept"
  },
  {
    "term": "Key Exchange",
    "definition": "The process by which two parties establish a shared secret key over an insecure channel. In PQC, replaced by Key Encapsulation Mechanisms.",
    "relatedModule": "/learn/tls-basics",
    "complexity": "beginner",
    "category": "concept"
  },
  {
    "term": "Quantum Advantage",
    "definition": "The point at which a quantum computer can solve a specific problem faster than any classical computer. Also called \"quantum supremacy.\"",
    "relatedModule": "/learn/quantum-threats",
    "complexity": "beginner",
    "category": "concept"
  },
  {
    "term": "WebAssembly",
    "acronym": "WASM",
    "definition": "A binary instruction format that enables near-native performance in web browsers. Used by PQC Today to run OpenSSL and liboqs in-browser.",
    "relatedModule": "/openssl",
    "complexity": "intermediate",
    "category": "concept"
  },
  {
    "term": "HSM",
    "acronym": "HSM",
    "definition": "Hardware Security Module, a dedicated physical device for managing and protecting cryptographic keys. Must be updated for PQC support.",
    "relatedModule": "/threats",
    "complexity": "intermediate",
    "category": "concept"
  },
  {
    "term": "Entanglement",
    "definition": "A quantum phenomenon where two qubits become correlated so measuring one instantly determines the state of the other, regardless of distance.",
    "relatedModule": "/learn/pqc-101",
    "complexity": "beginner",
    "category": "concept"
  },
  {
    "term": "HD Wallet",
    "acronym": "HD",
    "definition": "Hierarchical Deterministic Wallet, a cryptocurrency wallet that generates all key pairs from a single seed phrase using BIP32/39/44 standards.",
    "relatedModule": "/learn/digital-assets",
    "complexity": "intermediate",
    "category": "concept"
  },
  {
    "term": "BIP39",
    "definition": "Bitcoin Improvement Proposal 39 defines mnemonic seed phrases (12 or 24 words) used to back up and restore cryptocurrency wallets.",
    "relatedModule": "/learn/digital-assets",
    "complexity": "intermediate",
    "category": "concept"
  },
  {
    "term": "EUDI Wallet",
    "definition": "European Union Digital Identity Wallet, a mobile wallet for storing and presenting digital credentials under the eIDAS 2.0 framework.",
    "relatedModule": "/learn/digital-id",
    "complexity": "intermediate",
    "category": "concept"
  },
  {
    "term": "Qualified Electronic Signature",
    "acronym": "QES",
    "definition": "A digital signature with the legal equivalence of a handwritten signature under EU law, requiring a qualified certificate and a secure creation device.",
    "relatedModule": "/learn/digital-id",
    "complexity": "advanced",
    "category": "concept"
  },
  {
    "term": "MILENAGE",
    "definition": "The set of cryptographic functions (f1–f5) used in 5G authentication. Based on AES and generates authentication vectors.",
    "relatedModule": "/learn/5g-security",
    "complexity": "advanced",
    "category": "concept"
  },
  {
    "term": "Encapsulation / Decapsulation",
    "definition": "The two operations of a Key Encapsulation Mechanism. Encapsulation creates a shared secret using a public key; decapsulation recovers it using the private key.",
    "technicalNote": "Unlike Diffie-Hellman key exchange, KEMs are asymmetric: the sender encapsulates, the receiver decapsulates. This is the core operation of ML-KEM.",
    "relatedModule": "/playground",
    "complexity": "intermediate",
    "category": "concept"
  },
  {
    "term": "Learning With Errors",
    "acronym": "LWE",
    "definition": "A mathematical problem believed to be hard for quantum computers, forming the security foundation of ML-KEM, ML-DSA, and FrodoKEM.",
    "technicalNote": "Variants include Ring-LWE (structured, faster) and Module-LWE (used in ML-KEM/ML-DSA, balancing security and performance).",
    "relatedModule": "/algorithms",
    "complexity": "advanced",
    "category": "concept"
  },
  {
    "term": "NTRU Lattice",
    "acronym": "NTRU",
    "definition": "A lattice-based cryptographic family using polynomial rings, providing the mathematical basis for FN-DSA (Falcon). One of the earliest PQC proposals (1996).",
    "relatedModule": "/algorithms",
    "complexity": "advanced",
    "category": "concept"
  },
  {
    "term": "Hybrid Key Exchange",